{
  "$schema": "./sandbox-feasibility.schema.json",
  "schemaVersion": "1.0.0",
  "releaseTrainId": "oc-2026.7.1-2-locked.1",
  "capturedAt": "2026-08-12T01:00:00+07:00",
  "evidencePolicy": {
    "levels": [
      "spike-tested",
      "documented-primary-source",
      "assumption-pending",
      "blocked-or-not-feasible"
    ],
    "presenceIsIsolationProof": false,
    "ciRunnerIsUserDeviceProof": false,
    "advertisingRequiresRealProductEvidence": true
  },
  "spikeBoundary": {
    "fixtureOnly": true,
    "mayInstallSoftware": false,
    "mayUseCredentials": false,
    "mayUseNetwork": false,
    "maySpawnProcesses": false,
    "mayWriteOutsideOsTemp": false,
    "claimsIsolation": false
  },
  "probeSourceLocks": [
    {
      "path": "src/sandbox/feasibility-probe.mjs",
      "sha256": "69b8b7927a1900b72b8d577ed0827c98ef0b016a18470407e4ac90f226602a82"
    },
    {
      "path": "scripts/spike/sandbox-feasibility-probe.mjs",
      "sha256": "30e6884e567b36917287b2b59f838c191c383f0e3deb2337a0610b9ebacad5a9"
    }
  ],
  "reviewGate": {
    "status": "pending",
    "requiredReviewers": [
      "Senior platform reviewer",
      "Independent security reviewer"
    ],
    "productOwnerDecision": "pending"
  },
  "promotionPolicy": {
    "enabled": false,
    "requiresProductOwnerAcceptance": true,
    "requiresIndependentReview": true,
    "requiresRealProductIsolationEvidence": true,
    "requiredPlatforms": [
      "win32",
      "darwin",
      "linux"
    ],
    "requiredControls": [
      "filesystem-containment",
      "network-deny-by-default",
      "process-boundary",
      "credential-isolation",
      "backend-health",
      "failure-recovery",
      "update-rollback"
    ],
    "allowsPresenceOnlyEvidence": false,
    "allowsCiRunnerAsUserDeviceEvidence": false
  },
  "safeDefault": {
    "execution": "blocked",
    "sandboxMode": "off",
    "workspaceAccess": "none",
    "networkEgress": "none",
    "productHostExec": false,
    "elevatedExec": false,
    "sensitiveBrowser": false,
    "automaticFallback": false,
    "advertisable": false,
    "reason": "No backend has independent review plus real three-OS product evidence."
  },
  "governanceTraceability": {
    "decisionRefs": [
      "D-0018"
    ],
    "riskThreatRefs": {
      "R-001": [
        "T-06",
        "T-08",
        "T-09",
        "T-10"
      ],
      "R-020": [
        "T-02",
        "T-05",
        "T-08",
        "T-12",
        "T-14"
      ],
      "R-028": [
        "T-08",
        "T-10"
      ],
      "R-029": [
        "T-02",
        "T-03",
        "T-14"
      ],
      "R-030": [
        "T-08",
        "T-10"
      ]
    }
  },
  "directions": [
    {
      "id": "local-managed-container",
      "name": "Container runtime cục bộ do AI for Boss quản lý",
      "decision": "preferred-contingent",
      "evidenceLevel": "documented-primary-source",
      "sourceRefs": [
        "SRC-01",
        "SRC-03",
        "SRC-04",
        "SRC-05",
        "SRC-06",
        "SRC-07"
      ],
      "isolation": {
        "rating": "medium-to-strong-when-hardened",
        "basis": "OpenClaw Docker uses container namespaces and defaults to no network, read-only root and all capabilities dropped; Docker still shares a host or VM kernel and the daemon is a privileged attack surface unless rootless.",
        "testedInFeature": false
      },
      "platforms": {
        "windows": "conditional-on-supported-virtualization-backend-and-runtime",
        "macos": "conditional-on-supported-virtualization-backend-and-runtime",
        "linux": "conditional-on-kernel-runtime-and-policy-prerequisites"
      },
      "installationAndPrivilege": [
        "A container engine or desktop VM backend must exist and remain healthy.",
        "Windows per-user Docker Desktop can install without admin, but WSL 2 or another supported VM backend and hardware virtualization remain prerequisites.",
        "macOS can avoid selected privileged helpers, but default setup requests limited privileged configuration.",
        "Linux rootless Docker reduces daemon privilege but requires subordinate UID/GID prerequisites."
      ],
      "dataAndNetwork": {
        "workspace": "Local bind or isolated copy; any bind expands host exposure.",
        "networkDefault": "none",
        "externalDataTransfer": "No sandbox data leaves the device unless a separately approved provider or network route is enabled.",
        "lockedControls": [
          "No host Docker socket inside an agent container",
          "No host network or container namespace join",
          "No external bind outside approved project roots",
          "No secret in container environment metadata"
        ]
      },
      "costLicenseDependency": {
        "software": "Locked OpenClaw source is MIT. Docker Engine/Moby open-source licensing differs from Docker Desktop subscription terms.",
        "commercial": "Docker Desktop requires a paid subscription for larger enterprises under Docker terms; redistribution and embedding require legal review.",
        "externalDependency": "Container engine, image supply chain and OS virtualization stack."
      },
      "recoveryUpdateFailure": {
        "failure": "Missing daemon, image or platform prerequisite must fail closed without host-exec fallback.",
        "recovery": "Recreate the sandbox from verified config and image; keep user-owned workspace canonical only through an explicit grant.",
        "update": "Pin image/runtime compatibility, stage updates and retain a rollback path."
      },
      "ordinaryUserFit": "possible-after-dedicated-installer-health-recovery-and-usability-evidence",
      "remainingBlockedCapabilities": [
        "product host exec",
        "elevated exec",
        "sensitive browser automation",
        "external bind mounts",
        "network egress",
        "unattended execution"
      ]
    },
    {
      "id": "remote-openshell-ssh",
      "name": "Sandbox từ xa qua OpenShell hoặc SSH",
      "decision": "optional-research-only",
      "evidenceLevel": "documented-primary-source",
      "sourceRefs": [
        "SRC-01",
        "SRC-02",
        "SRC-08",
        "SRC-09",
        "SRC-10"
      ],
      "isolation": {
        "rating": "depends-on-remote-operator-and-policy",
        "basis": "OpenClaw moves tool execution to an SSH-accessible host or OpenShell-managed environment. NVIDIA labels OpenShell alpha software; AI for Boss therefore does not accept it as a production default without later maturity, security and operations evidence.",
        "testedInFeature": false
      },
      "platforms": {
        "windows": "generic-ssh-client-possible-openshell-windows-experimental",
        "macos": "client-and-runtime-prerequisites-required",
        "linux": "client-and-runtime-prerequisites-required"
      },
      "installationAndPrivilege": [
        "Requires OpenSSH client plus host identity material for generic SSH.",
        "OpenShell requires plugin, CLI, account or gateway access and sandbox policy.",
        "Remote compute, lifecycle and policy are outside the local desktop trust boundary."
      ],
      "dataAndNetwork": {
        "workspace": "SSH seeds a remote-canonical workspace; OpenShell mirror uploads and downloads every exec turn while remote mode seeds once and keeps remote state canonical.",
        "networkDefault": "controlled-by-remote-host-or-openshell-policy",
        "externalDataTransfer": "Selected workspace content, tool input/output and metadata cross the network to the remote environment.",
        "lockedControls": [
          "Strict host verification",
          "No silent mirror or remote-mode switch",
          "No production OpenShell while upstream labels it alpha",
          "No sensitive browser because locked backends do not support it"
        ]
      },
      "costLicenseDependency": {
        "software": "OpenShell is Apache-2.0 and the locked OpenClaw plugin is under the OpenClaw MIT repository.",
        "commercial": "Remote compute, storage, egress, support and account pricing are operator/provider costs; no product cost model is proven.",
        "externalDependency": "Network, remote host identity, account, policy service and remote lifecycle."
      },
      "recoveryUpdateFailure": {
        "failure": "Network, SSH identity, host-key or remote lifecycle failure must stop the task and preserve local state.",
        "recovery": "SSH/OpenShell recreate can delete remote canonical state and reseed; recovery requires explicit user-visible state ownership.",
        "update": "Client, plugin, remote gateway, image and policy versions must remain compatible."
      },
      "ordinaryUserFit": "not-ready-for-default",
      "remainingBlockedCapabilities": [
        "production use of alpha OpenShell",
        "sensitive browser automation",
        "credential injection",
        "customer data upload without consent",
        "shared multi-tenant fallback"
      ]
    },
    {
      "id": "native-os-restrictions",
      "name": "Cơ chế hạn chế native theo từng hệ điều hành",
      "decision": "rejected-as-primary-backend",
      "evidenceLevel": "documented-primary-source",
      "sourceRefs": [
        "SRC-11",
        "SRC-12",
        "SRC-13",
        "SRC-14",
        "SRC-15",
        "SRC-16",
        "SRC-17",
        "SRC-18"
      ],
      "isolation": {
        "rating": "inconsistent-across-platforms",
        "basis": "Windows AppContainer, macOS App Sandbox and Linux namespaces/seccomp/Landlock/cgroup expose different contracts. Linux seccomp documentation explicitly says syscall filtering alone is not a sandbox.",
        "testedInFeature": false
      },
      "platforms": {
        "windows": "appcontainer-and-hypervisor-options-exist",
        "macos": "entitlement-and-code-signing-model-exists",
        "linux": "multiple-kernel-primitives-must-be-composed-and-feature-detected"
      },
      "installationAndPrivilege": [